<!ELEMENT practicas (alumno*)>
<!ELEMENT alumno (NIF,resultado,obserbaciones?,(ip|mac))>
<!ELEMENT NIF (#PCDATA)>
<!ELEMENT resultado (#PCDATA)>
<!ELEMENT observaciones (#PCDATA)>
<!ELEMENT ip (#PCDATA)>
<!ELEMENT mac (#PCDATA)>